<!--
  ~ Copyright 2009 Denys Pavlov, Igor Azarnyi
  ~
  ~    Licensed under the Apache License, Version 2.0 (the "License");
  ~    you may not use this file except in compliance with the License.
  ~    You may obtain a copy of the License at
  ~
  ~        http://www.apache.org/licenses/LICENSE-2.0
  ~
  ~    Unless required by applicable law or agreed to in writing, software
  ~    distributed under the License is distributed on an "AS IS" BASIS,
  ~    WITHOUT WARRANTIES OR CONDITIONS OF ANY KIND, either express or implied.
  ~    See the License for the specific language governing permissions and
  ~    limitations under the License.
  -->

<!--
    Schema for all import descriptor files.

    xmlns:xsi="http://www.w3.org/2001/XMLSchema-instance"
    xsi:noNamespaceSchemaLocation="http://www.yes-cart.org/schema/export-descriptor.xsd"

    This namespace is not actually pointing to the URL for schema, so you need to
    create an alias in your IDE that would point that namespace to this file.

    @author D.Pavlov
 -->
<xs:schema xmlns:xs="http://www.w3.org/2001/XMLSchema">

    <xs:element name="export-descriptor" type="ExportDescriptorType"/>

    <xs:complexType name="ExportDescriptorType">
        <xs:annotation>
            <xs:documentation>
                Defines the schema for how to represent an export descriptor.
                In general it maps and entity type (by interface) to columns in
                tuples target (e.g. a CSV file).

                File descriptor section specifies file specific configurations and columns
                define the actual mapping for columns to entity type.

                select-sql defines query that is to be used to look up existing object (HSQL)

                Syntax for queries follows HSQL with parameters specified as column names
                in curly brackets.
                e.g.
                    HSQL: select c from CategoryEntity c where c.guid = {guid}
                There are special placeholders in addition to {column} placeholders:
                1. {masterObjectId} PK of the master object
                2. {masterObject} master instance (for use with HSQL)
                3. {GUID} auto generated guid (for use with native SQL inserts)

            </xs:documentation>
        </xs:annotation>
        <xs:sequence>
            <xs:element name="context" type="ContextType" minOccurs="0"/>
            <xs:element name="entity-type" type="xs:string" minOccurs="1"/>
            <xs:element name="export-file-descriptor" type="ExportFileDescriptorType" minOccurs="1"/>
            <xs:element name="select-sql" type="xs:string" minOccurs="1"/>
            <xs:element name="export-columns" type="ExportColumnsType" minOccurs="1"/>
        </xs:sequence>

    </xs:complexType>


    <xs:complexType name="ContextType">
        <xs:annotation>
            <xs:documentation>
                Context defines additional runtime constraints.
            </xs:documentation>
        </xs:annotation>
        <xs:sequence>
            <xs:choice minOccurs="0" maxOccurs="1">
                <xs:element name="shop-code" type="xs:string" minOccurs="0"/>
                <xs:element name="shop-code-column" type="xs:string" minOccurs="0"/>
            </xs:choice>
        </xs:sequence>
    </xs:complexType>


    <xs:complexType name="ExportFileDescriptorType">
        <xs:annotation>
            <xs:documentation>
                File configurations.

                file-name specifies full absolute path to where the export file should be written to.
            </xs:documentation>
        </xs:annotation>
        <xs:sequence>
            <xs:element name="file-encoding" type="xs:string"/>
            <xs:element name="file-name" type="xs:string"/>
            <xs:element name="print-header" type="xs:boolean"/>
            <xs:element name="column-delimiter" type="xs:string"/>
            <xs:element name="text-qualifier" type="xs:string"/>
        </xs:sequence>
    </xs:complexType>


    <xs:complexType name="ExportColumnsType">
        <xs:sequence>
            <xs:element name="column-descriptor" minOccurs="1" maxOccurs="unbounded" type="ExportColumnType"/>
        </xs:sequence>
    </xs:complexType>

    <xs:complexType name="ExportColumnType">
        <xs:annotation>
            <xs:documentation>
                Column header defines the header of a column in a tuple that is represented by
                a property with name (i.e. name element) on the entity type.

                If language defines the values will be attempted to be exported as a i18n.
                The language specified must be exactly the same configuration as Locale used by
                YeS (Yes Shop).

                Field type defines what type of field this is and will define the export strategy
                for that field (e.g. FK_FIELD would fetch a parent entity using lookup-query).
                For FK field entity-type must be specified to auto generate parent dependencies.

                Value regex allows to extract data from the data to allow more control over what
                gets exported from entity. By default group 1 is selected as the value but it is possible
                to define custom group by specifying regex group element.

                Constants just mean that some columns will be prepopulated with values. This is
                useful in some case, as for example setting default online properties for products.

                Lookup query is used to check if the entity exists for normal fields or to retrieve
                parent entities for FK fields. The query syntax follows HSQL (Hibernate) syntax
            </xs:documentation>
        </xs:annotation>
        <xs:sequence>
            <xs:element name="column-header" type="xs:string"/>
            <xs:element name="field-type" type="xs:string">
                <xs:annotation>
                    <xs:documentation>
                        This field must correspond to org.yes.cart.bulkcommon.model.ImpExColumn constants.
                        I.e. FIELD, FK_FIELD, SLAVE_INLINE_FIELD, SLAVE_TUPLE_FIELD
                        This field is not restricted to allow more flexibility in custom implementations
                    </xs:documentation>
                </xs:annotation>
            </xs:element>
            <xs:element name="data-type" type="xs:string" minOccurs="0">
                <xs:annotation>
                    <xs:documentation>
                        This field must correspond to org.yes.cart.bulkcommon.model.ImpExColumn constants.
                        I.e. STRING, BOOLEAN, LONG, INT, DECIMAL, DATETIME
                        This field is not restricted to allow more flexibility in custom implementations
                    </xs:documentation>
                </xs:annotation>
            </xs:element>
            <xs:element name="entity-type" type="xs:string" minOccurs="0"/>
            <xs:element name="name" type="xs:string"/>
            <xs:element name="language" type="xs:string" minOccurs="0"/>
            <xs:element name="context" type="xs:string" minOccurs="0"/>
            <xs:element name="value-regex" type="xs:string" minOccurs="0"/>
            <xs:choice minOccurs="0" maxOccurs="1">
                <xs:element name="value-regex-group" type="xs:string" minOccurs="0"/>
                <xs:element name="value-regex-template" type="xs:string" minOccurs="0"/>
            </xs:choice>
            <xs:element name="value-constant" type="xs:string" minOccurs="0"/>
            <xs:element name="lookup-query" type="xs:string" minOccurs="0"/>
            <xs:element name="use-master-object" type="xs:boolean" minOccurs="0"/>
            <xs:element name="export-descriptor" type="ExportDescriptorType" minOccurs="0"/>
        </xs:sequence>
    </xs:complexType>
</xs:schema>
