<!--
  ~ Copyright 2009 Denys Pavlov, Igor Azarnyi
  ~
  ~    Licensed under the Apache License, Version 2.0 (the "License");
  ~    you may not use this file except in compliance with the License.
  ~    You may obtain a copy of the License at
  ~
  ~        http://www.apache.org/licenses/LICENSE-2.0
  ~
  ~    Unless required by applicable law or agreed to in writing, software
  ~    distributed under the License is distributed on an "AS IS" BASIS,
  ~    WITHOUT WARRANTIES OR CONDITIONS OF ANY KIND, either express or implied.
  ~    See the License for the specific language governing permissions and
  ~    limitations under the License.
  -->

<export-descriptor xmlns:xsi="http://www.w3.org/2001/XMLSchema-instance"
                   xsi:noNamespaceSchemaLocation="file:../../../../../../domain-api/src/main/resources/META-INF/schema/export-descriptor.xsd">

    <entity-type>org.yes.cart.domain.entity.Attribute</entity-type>

    <export-file-descriptor>
        <file-encoding>UTF-8</file-encoding>
        <file-name>target/attributenames_export-{timestamp}.csv</file-name>
        <print-header>true</print-header>
        <column-delimiter>;</column-delimiter>
        <text-qualifier>&quot;</text-qualifier>
    </export-file-descriptor>

    <select-sql>select b from AttributeEntity b where b.attributeGroup.code = 'PRODUCT'</select-sql>

    <export-columns>

        <column-descriptor>
            <column-header>Group</column-header>
            <field-type>FK_FIELD</field-type>
            <entity-type>org.yes.cart.domain.entity.AttributeGroup</entity-type>
            <name>attributeGroup.code</name>
        </column-descriptor>

        <column-descriptor> <!-- primary key -->
            <column-header>Code</column-header>
            <field-type>FIELD</field-type>
            <name>code</name>
            <value-regex>(.{0,255})(.*)</value-regex>
            <value-regex-group>1</value-regex-group>
        </column-descriptor>

        <column-descriptor>
            <column-header>Name</column-header>
            <field-type>FIELD</field-type>
            <name>name</name>
            <value-regex>(.{0,255})(.*)</value-regex>
            <value-regex-group>1</value-regex-group>
        </column-descriptor>

        <column-descriptor>
            <column-header>Description</column-header>
            <field-type>FIELD</field-type>
            <name>description</name>
            <value-regex>(.{0,4000})(.*)</value-regex>
            <value-regex-group>1</value-regex-group>
        </column-descriptor>

        <column-descriptor>
            <column-header>Display Name En</column-header>
            <field-type>FIELD</field-type>
            <name>displayName</name>
            <language>en</language>
            <value-regex>(.{0,255})(.*)</value-regex>
            <value-regex-group>1</value-regex-group>
        </column-descriptor>

        <column-descriptor>
            <column-header>Display Name Ru</column-header>
            <field-type>FIELD</field-type>
            <name>displayName</name>
            <language>ru</language>
            <value-regex>(.{0,255})(.*)</value-regex>
            <value-regex-group>1</value-regex-group>
        </column-descriptor>

        <column-descriptor>
            <column-header>Mandatory</column-header>
            <field-type>FIELD</field-type>
            <data-type>BOOLEAN</data-type>
            <name>mandatory</name>
        </column-descriptor>

        <column-descriptor>
            <column-header>Allow Dup (Constant)</column-header>
            <field-type>FIELD</field-type>
            <data-type>BOOLEAN</data-type>
            <name>allowduplicate</name>
            <value-constant>false</value-constant>
        </column-descriptor>

        <column-descriptor>
            <column-header>Allow Failver (template)</column-header>
            <field-type>FIELD</field-type>
            <data-type>BOOLEAN</data-type>
            <name>allowfailover</name>
            <value-regex>(.*)</value-regex>
            <value-regex-template>Failover is: $1</value-regex-template>
        </column-descriptor>

        <column-descriptor>
            <column-header>Rank</column-header>
            <field-type>FIELD</field-type>
            <data-type>INT</data-type>
            <name>rank</name>
            <value-constant>500</value-constant>
        </column-descriptor>

        <column-descriptor>
            <column-header>Java Type</column-header>
            <field-type>FIELD</field-type>
            <entity-type>org.yes.cart.domain.entity.Etype</entity-type>
            <name>etype.javatype</name>
        </column-descriptor>

    </export-columns>
</export-descriptor>