<!--
  ~ Copyright 2009 Denys Pavlov, Igor Azarnyi
  ~
  ~    Licensed under the Apache License, Version 2.0 (the "License");
  ~    you may not use this file except in compliance with the License.
  ~    You may obtain a copy of the License at
  ~
  ~        http://www.apache.org/licenses/LICENSE-2.0
  ~
  ~    Unless required by applicable law or agreed to in writing, software
  ~    distributed under the License is distributed on an "AS IS" BASIS,
  ~    WITHOUT WARRANTIES OR CONDITIONS OF ANY KIND, either express or implied.
  ~    See the License for the specific language governing permissions and
  ~    limitations under the License.
  -->

<export-descriptor xmlns:xsi="http://www.w3.org/2001/XMLSchema-instance"
                   xsi:noNamespaceSchemaLocation="file:../../../../../../domain-api/src/main/resources/META-INF/schema/export-descriptor.xsd">

    <context>
        <shop-code>SHOIP1</shop-code>
    </context>

    <entity-type>org.yes.cart.domain.entity.Product</entity-type>

    <export-file-descriptor>
        <file-encoding>UTF-8</file-encoding>
        <file-name>target/productnames_export-{timestamp}.csv</file-name>
        <print-header>true</print-header>
        <column-delimiter>;</column-delimiter>
        <text-qualifier>&quot;</text-qualifier>
    </export-file-descriptor>

    <select-sql>select p from ProductEntity p</select-sql>

    <export-columns>

        <!-- Primary key -->
        <column-descriptor>
            <column-header>GUID</column-header>
            <field-type>FIELD</field-type>
            <name>guid</name>
            <value-regex>(.{0,255})(.*)</value-regex>
            <value-regex-group>1</value-regex-group>
        </column-descriptor>

        <!-- SKU code -->
        <column-descriptor>
            <column-header>SKU code</column-header>
            <field-type>FIELD</field-type>
            <name>code</name>
            <value-regex>(.{0,255})(.*)</value-regex>
            <value-regex-group>1</value-regex-group>
        </column-descriptor>

        <!-- Display names -->
        <column-descriptor>
            <column-header>Name En</column-header>
            <field-type>FIELD</field-type>
            <name>displayName</name>
            <language>en</language>
        </column-descriptor>

        <column-descriptor>
            <column-header>Name Ru</column-header>
            <field-type>FIELD</field-type>
            <name>displayName</name>
            <language>ru</language>
        </column-descriptor>

        <!-- brand -->
        <column-descriptor>
            <column-header>Brand</column-header>
            <field-type>FK_FIELD</field-type>
            <entity-type>org.yes.cart.domain.entity.Brand</entity-type>
            <name>brand.name</name>
            <value-regex>(.*)</value-regex>
            <value-regex-template>Brand is: $1</value-regex-template>
        </column-descriptor>

        <column-descriptor>
            <column-header>Attribute Slave Inline All</column-header>
            <field-type>SLAVE_INLINE_FIELD</field-type>
            <name>attributes</name>
            <export-descriptor>
                <entity-type>org.yes.cart.domain.entity.AttrValueProduct</entity-type>
                <export-file-descriptor>
                    <file-encoding>UTF-8</file-encoding>
                    <file-name/>
                    <print-header>false</print-header>
                    <column-delimiter>&#09;</column-delimiter>
                    <text-qualifier>#</text-qualifier>
                </export-file-descriptor>
                <select-sql/>
                <export-columns>
                    <column-descriptor>
                        <column-header/>
                        <field-type>FK_FIELD</field-type>
                        <name>attribute.code</name>
                    </column-descriptor>
                    <column-descriptor>
                        <column-header/>
                        <field-type>FIELD</field-type>
                        <name>val</name>
                    </column-descriptor>
                </export-columns>
            </export-descriptor>
        </column-descriptor>

        <column-descriptor>
            <column-header>Attribute Slave Inline Image0</column-header>
            <field-type>SLAVE_INLINE_FIELD</field-type>
            <name>attributes</name>
            <export-descriptor>
                <entity-type>org.yes.cart.domain.entity.AttrValueProduct</entity-type>
                <export-file-descriptor>
                    <file-encoding>UTF-8</file-encoding>
                    <file-name/>
                    <print-header>false</print-header>
                    <column-delimiter>,</column-delimiter>
                    <text-qualifier> </text-qualifier>
                </export-file-descriptor>
                <select-sql>select avp from AttrValueEntityProduct avp where avp.product = {masterObject} and avp.attribute.code = 'IMAGE0'</select-sql>
                <export-columns>
                    <column-descriptor>
                        <column-header/>
                        <field-type>FIELD</field-type>
                        <name>val</name>
                    </column-descriptor>
                </export-columns>
            </export-descriptor>
        </column-descriptor>

        <column-descriptor>
            <column-header>Categories</column-header>
            <field-type>SLAVE_TUPLE_FIELD</field-type>
            <name>productCategory</name>
            <export-descriptor>
                <entity-type>org.yes.cart.domain.entity.AttrValueProduct</entity-type>
                <export-file-descriptor>
                    <file-encoding>UTF-8</file-encoding>
                    <file-name/>
                    <print-header>false</print-header>
                    <column-delimiter>&#09;</column-delimiter>
                    <text-qualifier>#</text-qualifier>
                </export-file-descriptor>
                <select-sql/>
                <export-columns>
                    <column-descriptor>
                        <column-header>Category GUID</column-header>
                        <field-type>FIELD</field-type>
                        <name>category.guid</name>
                    </column-descriptor>
                    <column-descriptor>
                        <column-header>Category Name</column-header>
                        <field-type>FIELD</field-type>
                        <name>category.name</name>
                    </column-descriptor>
                </export-columns>
            </export-descriptor>
        </column-descriptor>

        <column-descriptor>
            <column-header>Attribute by Code</column-header>
            <field-type>FIELD</field-type>
            <data-type>AVC</data-type>
            <name>attributes</name>
            <context>IMAGE0</context>
        </column-descriptor>

        <column-descriptor>
            <column-header>Price by Product ID Currency</column-header>
            <field-type>FIELD</field-type>
            <data-type>PRICE</data-type>
            <name>productId</name>
            <context>USD</context>
        </column-descriptor>

        <column-descriptor>
            <column-header>Price by SKU Currency</column-header>
            <field-type>FIELD</field-type>
            <data-type>PRICE</data-type>
            <name>code</name>
            <context>USD</context>
        </column-descriptor>

    </export-columns>
</export-descriptor>